{
  "id": "carrier_labels_mtd",
  "version": 1,
  "icon": "truck",
  "category": "logistics",
  "order": 311,
  "kpi": {
    "key": "carrier_labels_mtd",
    "unit": "count",
    "value_type": "number",
    "group": "shipping",
    "value_source": "push"
  },
  "locales": {
    "en": {
      "title": "Labels this month",
      "description": "Shipping labels created this month."
    },
    "de": {
      "title": "Paketmarken (Monat)",
      "description": "In diesem Monat erzeugte Versandlabels."
    }
  }
}
